{
  "schemaVersion": 1,
  "id": "sqlite-operation-baseline-v2-vectors-v1",
  "status": "contract-frozen",
  "implementationClaim": false,
  "domains": {
    "baselineId": "graph-engineering/sqlite-operation-baseline-id/v1\u0000",
    "entry": "graph-engineering/sqlite-operation-baseline-entry/v1\u0000",
    "projection": "graph-engineering/sqlite-operation-baseline-projection/v1\u0000",
    "genesis": "graph-engineering/sqlite-operation-baseline-genesis/v1\u0000",
    "empty": "graph-engineering/sqlite-operation-baseline-empty/v1\u0000",
    "genesisHash": "5311dba7ae8b844fc3efccd55dd90c3f78e02a7f7e222d7a0a513fd1aff9ec96",
    "emptyRoot": "66a081bbc7369b674fa093cb2e3e1d269a1eb506698e24dfc2899074bf06b82a"
  },
  "sourceEnvelope": {
    "capturedAtMs": 1735689601234,
    "sourceApplicationId": 1195724359,
    "sourceDescriptorHash": "4071e4e5e2cddad01af4f87e4df45fa55bbc4e238674174ce40eca765d2c03fe",
    "sourceMigrationLineageId": "alpha-v0-to-v1",
    "sourceMigrationLineageSha256": "a8e9de4d1bae81f8405ef611fca1298bef024ad1df5e905d1d5a9357d1e8cb9c",
    "sourceSchemaIdentitySha256": "f3d961d4d96e93a7fab13a91b374c27ff877a93332ff7ed7426f1fff982baff4",
    "sourceUserVersion": 1
  },
  "baselineId": "v2-e43886d3883954231f8101d31b7d43cb4f70e0bca9c7cb25b2f34ce51256609d",
  "policyVector": {
    "value": {
      "baselineFormatVersion": 1,
      "canonicalEncoding": "graph-engineering/canonical-json/v1",
      "cursorReplay": "independent-semantic-audit",
      "emptyRoot": "66a081bbc7369b674fa093cb2e3e1d269a1eb506698e24dfc2899074bf06b82a",
      "entryHashDomain": "graph-engineering/sqlite-operation-baseline-entry/v1\u0000",
      "entryKinds": [
        "schema-envelope",
        "migration-lineage",
        "stream-head",
        "record-identity",
        "checkpoint-current",
        "checkpoint-revision",
        "lease-current",
        "used-lease-identity",
        "legal-hold",
        "migration-lock-current",
        "used-migration-lock-identity",
        "legacy-operation"
      ],
      "genesisHash": "5311dba7ae8b844fc3efccd55dd90c3f78e02a7f7e222d7a0a513fd1aff9ec96",
      "legacyRequestRecovery": false,
      "maxEntryKeyBytes": 4096,
      "maxEntryStateBytes": 2097152,
      "payloadOmissions": [
        "checkpoint-value",
        "record-blob",
        "record-value"
      ],
      "projectionHashDomain": "graph-engineering/sqlite-operation-baseline-projection/v1\u0000",
      "replayStartsAtCommitSequence": 1,
      "sort": [
        "entry-kind-rank",
        "entry-key-utf8-bytes"
      ]
    },
    "canonicalUtf8": "{\"baselineFormatVersion\":1,\"canonicalEncoding\":\"graph-engineering/canonical-json/v1\",\"cursorReplay\":\"independent-semantic-audit\",\"emptyRoot\":\"66a081bbc7369b674fa093cb2e3e1d269a1eb506698e24dfc2899074bf06b82a\",\"entryHashDomain\":\"graph-engineering/sqlite-operation-baseline-entry/v1\\u0000\",\"entryKinds\":[\"schema-envelope\",\"migration-lineage\",\"stream-head\",\"record-identity\",\"checkpoint-current\",\"checkpoint-revision\",\"lease-current\",\"used-lease-identity\",\"legal-hold\",\"migration-lock-current\",\"used-migration-lock-identity\",\"legacy-operation\"],\"genesisHash\":\"5311dba7ae8b844fc3efccd55dd90c3f78e02a7f7e222d7a0a513fd1aff9ec96\",\"legacyRequestRecovery\":false,\"maxEntryKeyBytes\":4096,\"maxEntryStateBytes\":2097152,\"payloadOmissions\":[\"checkpoint-value\",\"record-blob\",\"record-value\"],\"projectionHashDomain\":\"graph-engineering/sqlite-operation-baseline-projection/v1\\u0000\",\"replayStartsAtCommitSequence\":1,\"sort\":[\"entry-kind-rank\",\"entry-key-utf8-bytes\"]}",
    "canonicalHex": "7b22626173656c696e65466f726d617456657273696f6e223a312c2263616e6f6e6963616c456e636f64696e67223a2267726170682d656e67696e656572696e672f63616e6f6e6963616c2d6a736f6e2f7631222c22637572736f725265706c6179223a22696e646570656e64656e742d73656d616e7469632d6175646974222c22656d707479526f6f74223a2236366130383162626337333639623637346661303933636232653365316432363961316562353036363938653234646663323839393037346266303662383261222c22656e74727948617368446f6d61696e223a2267726170682d656e67696e656572696e672f73716c6974652d6f7065726174696f6e2d626173656c696e652d656e7472792f76315c7530303030222c22656e7472794b696e6473223a5b22736368656d612d656e76656c6f7065222c226d6967726174696f6e2d6c696e65616765222c2273747265616d2d68656164222c227265636f72642d6964656e74697479222c22636865636b706f696e742d63757272656e74222c22636865636b706f696e742d7265766973696f6e222c226c656173652d63757272656e74222c22757365642d6c656173652d6964656e74697479222c226c6567616c2d686f6c64222c226d6967726174696f6e2d6c6f636b2d63757272656e74222c22757365642d6d6967726174696f6e2d6c6f636b2d6964656e74697479222c226c65676163792d6f7065726174696f6e225d2c2267656e6573697348617368223a2235333131646261376165386238343466633365666363643535646439306333663738653032613766376532323264376130613531336664316166663965633936222c226c6567616379526571756573745265636f76657279223a66616c73652c226d6178456e7472794b65794279746573223a343039362c226d6178456e74727953746174654279746573223a323039373135322c227061796c6f61644f6d697373696f6e73223a5b22636865636b706f696e742d76616c7565222c227265636f72642d626c6f62222c227265636f72642d76616c7565225d2c2270726f6a656374696f6e48617368446f6d61696e223a2267726170682d656e67696e656572696e672f73716c6974652d6f7065726174696f6e2d626173656c696e652d70726f6a656374696f6e2f76315c7530303030222c227265706c61795374617274734174436f6d6d697453657175656e6365223a312c22736f7274223a5b22656e7472792d6b696e642d72616e6b222c22656e7472792d6b65792d757466382d6279746573225d7d",
    "byteLength": 946,
    "sha256": "67cbe0ac8bf04f28061d50f8b7089312cc1e1f9a9520ede95deec0d1f4ec5eb0"
  },
  "entryVectors": [
    {
      "vectorId": "BL-V01",
      "category": "behavior",
      "entryKind": "schema-envelope",
      "ordinal": 0,
      "key": {
        "value": {
          "scope": "cycle-store"
        },
        "canonicalUtf8": "{\"scope\":\"cycle-store\"}",
        "canonicalHex": "7b2273636f7065223a226379636c652d73746f7265227d",
        "byteLength": 23,
        "sha256": "503bcea070592cf775430eae910c4ea8d602fafb27bb6a27e439c89f84935ff3"
      },
      "state": {
        "value": {
          "createdAtMs": 1735689600000,
          "currentVersion": 1,
          "latestMigrationAppliedAtMs": 1735689600100,
          "latestMigrationSha256": "a8e9de4d1bae81f8405ef611fca1298bef024ad1df5e905d1d5a9357d1e8cb9c",
          "maxReaderVersion": 1,
          "maxWriterVersion": 1,
          "minReaderVersion": 1,
          "minWriterVersion": 1,
          "providerDescriptorHash": "4071e4e5e2cddad01af4f87e4df45fa55bbc4e238674174ce40eca765d2c03fe",
          "schemaIdentitySha256": "f3d961d4d96e93a7fab13a91b374c27ff877a93332ff7ed7426f1fff982baff4",
          "updatedAtMs": 1735689600100
        },
        "canonicalUtf8": "{\"createdAtMs\":1735689600000,\"currentVersion\":1,\"latestMigrationAppliedAtMs\":1735689600100,\"latestMigrationSha256\":\"a8e9de4d1bae81f8405ef611fca1298bef024ad1df5e905d1d5a9357d1e8cb9c\",\"maxReaderVersion\":1,\"maxWriterVersion\":1,\"minReaderVersion\":1,\"minWriterVersion\":1,\"providerDescriptorHash\":\"4071e4e5e2cddad01af4f87e4df45fa55bbc4e238674174ce40eca765d2c03fe\",\"schemaIdentitySha256\":\"f3d961d4d96e93a7fab13a91b374c27ff877a93332ff7ed7426f1fff982baff4\",\"updatedAtMs\":1735689600100}",
        "canonicalHex": "7b226372656174656441744d73223a313733353638393630303030302c2263757272656e7456657273696f6e223a312c226c61746573744d6967726174696f6e4170706c69656441744d73223a313733353638393630303130302c226c61746573744d6967726174696f6e536861323536223a2261386539646534643162616538316638343035656636313166636131323938626566303234616431646635653930356431643561393335376431653863623963222c226d617852656164657256657273696f6e223a312c226d617857726974657256657273696f6e223a312c226d696e52656164657256657273696f6e223a312c226d696e57726974657256657273696f6e223a312c2270726f766964657244657363726970746f7248617368223a2234303731653465356532636464616430316166346638376534646634356661353562626334653233383637343137346365343065636137363564326330336665222c22736368656d614964656e74697479536861323536223a2266336439363164346439366539336137666162313361393162333734633237666638373761393333333266663765643734323666316666663938326261666634222c227570646174656441744d73223a313733353638393630303130307d",
        "byteLength": 476,
        "sha256": "f53fbef49bc51a0f8eaa911f12c0374edb1e3cb27eb83697e2a8c26cc79a8f62"
      },
      "previousEntryHash": "5311dba7ae8b844fc3efccd55dd90c3f78e02a7f7e222d7a0a513fd1aff9ec96",
      "entryHash": "87d4a5e99f9ef10f87314c0d1b38d76dac592b3934b55bf607560d9f6872760f"
    },
    {
      "vectorId": "BL-V02",
      "category": "behavior",
      "entryKind": "migration-lineage",
      "ordinal": 1,
      "key": {
        "value": {
          "version": 1
        },
        "canonicalUtf8": "{\"version\":1}",
        "canonicalHex": "7b2276657273696f6e223a317d",
        "byteLength": 13,
        "sha256": "2430f1a2ad2982d0067885488a4c89e21ad1d7c83b115ba8f1b20acc88dfaea8"
      },
      "state": {
        "value": {
          "appliedAtMs": 1735689600100,
          "migrationId": "alpha-v0-to-v1",
          "postconditions": {
            "requiredPostconditions": [
              "application-id-matches",
              "user-version-is-1",
              "schema-singleton-is-manifest-bound",
              "migration-ledger-row-is-manifest-bound",
              "all-canonical-tables-are-strict",
              "logical-schema-identity-matches-fresh-v1",
              "foreign-key-check-is-empty",
              "integrity-check-is-ok",
              "alpha-row-counts-are-preserved",
              "stream-heads-match-record-tails",
              "canonical-blobs-and-hashes-are-preserved",
              "checkpoint-revisions-are-seeded",
              "lease-and-migration-fences-are-monotonic",
              "no-v0-or-placeholder-state-remains"
            ]
          },
          "previousVersion": 0,
          "reversibility": "rebuild-from-verified-backup-only",